question_id,question,option_0,option_1,option_2,option_3,option_4,option_5,option_6,option_7,option_8,option_9,answer_index,cot_content,category,dialect
7733,"स्वास्थ्य विभाग एक विशिष्ट पार्क में सीसे के स्तर का परीक्षण करने की योजना बना रहा है। चूंकि सीसे का उच्च स्तर बच्चों के लिए हानिकारक है, यदि सीसे का स्तर अनुमत सीमा से अधिक होता है तो पार्क को बंद कर दिया जाएगा। विभाग पार्क में कई स्थानों का यादृच्छिक चयन करता है, उन स्थानों से मिट्टी के नमूने प्राप्त करता है, और नमूनों में सीसे के स्तर का परीक्षण करता है। निम्नलिखित में से कौन सा निर्णय प्रथम प्रकार की त्रुटि का परिणाम होगा?",जब सीसे का स्तर अनुमत सीमा के भीतर हो तब पार्क को खुला रखना,भविष्य में सीसे के स्तर में वृद्धि की भविष्यवाणी के आधार पर पार्क को बंद करना,जब सीसे का स्तर अनुमत सीमा से अधिक हो तब पार्क को खुला रखना,जब अन्य पार्कों में सीसे का स्तर अनुमत सीमा के भीतर हो तब उन्हें बंद करना,जब सीसे का स्तर अनुमत सीमा से अधिक हो तब पार्क को बंद करना,सीसे के स्तर का परीक्षण किए बिना ही पार्क को बंद करना,जब अन्य पार्कों में सीसे का स्तर अनुमत सीमा से अधिक हो तब उन्हें खुला रखना,परीक्षण परिणामों की अवहेलना करते हुए सीसे के स्तर की परवाह किए बिना पार्क को खुला रखना,जब सीसे का स्तर अनुमत सीमा के भीतर हो तब पार्क को बंद करना,किसी अन्य पार्क के सीसे के स्तर के आधार पर पार्क को बंद करना,8,,math,hi
7734,"10 अंकों के एक समूह में, सबसे बड़े अंक को 40 अंक से बढ़ाया जाता है। माध्य पर क्या प्रभाव पड़ेगा?",यह समान रहेगा।,यह 30 अंक बढ़ जाएगा।,यह 10 अंक बढ़ जाएगा।,यह 10 अंक घट जाएगा।,यह अपरिवर्तित रहेगा यदि अन्य अंक भी 40 अंक से बढ़ें।,यह 20 अंक बढ़ जाएगा।,यह 4 अंक घट जाएगा।,यह 40 अंक घट जाएगा।,यह 40 अंक बढ़ जाएगा।,यह 4 अंक बढ़ जाएगा।,9,,math,hi
7752,कौन सा अनुपात 3/8 के साथ समानुपात बना सकता है?,24/64,15/48,18/56,18/40,,,,,,,0,,math,hi
7762,एक दुकान में 8 मछली टैंक हैं जिनमें से प्रत्येक में 40 लीटर पानी है। सभी मछली टैंकों में कुल कितने लीटर पानी है?,400,380,280,300,360,340,5,420,320,48,8,,math,hi
7783,"एक घन के फलकों पर छह धनात्मक पूर्णांक लिखे गए हैं। प्रत्येक शीर्ष को उस शीर्ष से लगे तीन फलकों पर लिखी संख्याओं के गुणनफल से चिह्नित किया गया है। यदि शीर्षों पर लिखी संख्याओं का योग $1001$ के बराबर है, तो फलकों पर लिखी संख्याओं का योग क्या है?",36,31,15,20,13,18,27,24,1001,45,1,,math,hi
7794,मान लीजिए कि हम दो निष्पक्ष 6-पक्षीय पासे फेंकते हैं। दोनों संख्याओं का योग 4 होने की प्रायिकता क्या है?,\frac{3}{12},\frac{1}{6},\frac{2}{12},\frac{1}{9},\frac{1}{2},\frac{1}{18},\frac{1}{12},\frac{1}{3},\frac{1}{4},\frac{1}{8},6,,math,hi
7827,"मान लीजिए X_1, X_2,... स्वतंत्र चर हैं जो प्रत्येक +1 या -1 मान लेते हैं, जिनकी प्रायिकता 1/2 और 1/2 है। यह ज्ञात है कि $\sqrt{3/n^3}*\sum_{k=1}^n k*X_k$ सामान्य वितरण N(a,b) में वितरण में अभिसरित होता है जब n अनंत की ओर जाता है। यहाँ a प्रत्याशा है और b प्रसरण है। a और b के मान क्या हैं? उत्तर एक सूची के रूप में दें। उदाहरण के लिए, यदि a=2, b=100, तो [2,100] लौटाएं।","[2, 0]","[0, 1]","[2, 1]","[1, 1]","[1, 0]","[0, 0]","[0, 1/2]","[1, 2]","[0, 2]","[0, 3]",1,,math,hi
7828,"निम्नलिखित फलनों में से कौन-कौन से परिबद्ध संपूर्ण फलन हैं? 1. f(x)=0; 2. f(x)= 1+i; 3. f(x)=sin(x); 4. f(x)=min{|cos(x)|,1}. यहाँ i=\sqrt{-1} और $|\cdot|$ सम्मिश्र संख्या का मान है। उत्तरों की संख्या को एक सूची के रूप में दें।","[1, 2]","[2, 4]","[3, 4]","[1, 2, 3]","[1, 3, 4]","[1, 4]",[4],"[1, 3]",[3],"[2, 3]",0,,math,hi
7829,"वह सबसे छोटी धनात्मक पूर्णांक संख्या ज्ञात करें जो 2 से विभाजित करने पर शेषफल 1, 3 से विभाजित करने पर शेषफल 2, 4 से विभाजित करने पर शेषफल 3, 5 से विभाजित करने पर शेषफल 4, और 6 से विभाजित करने पर शेषफल 5 देती है।",59,91,101,121,65,143,50,72,61,119,0,,math,hi
7833,"स्टोक्स प्रमेय का उपयोग करके $\int_C \mathbf{F} \cdot d \mathbf{r}$ का मान ज्ञात कीजिए, जहाँ $\mathbf{F}(x, y, z)=x y \mathbf{i}+y z \mathbf{j}+z x \mathbf{k}$, और $C$ एक त्रिभुज है जिसके शीर्ष $(1,0,0),(0,1,0)$, और $(0,0,1)$ हैं, जो ऊपर से देखने पर वामावर्त दिशा में अभिविन्यस्त है।",$-\frac{1}{2}$,$\frac{1}{2}$,$0$,$\frac{3}{4}$,$\frac{1}{4}$,$-1$,$\frac{1}{3}$,$\frac{2}{3}$,$-\frac{1}{4}$,$-\frac{1}{3}$,0,,math,hi
7835,"7.3-9. महिलाओं के निम्नलिखित दो समूहों पर विचार करें: समूह 1 में वे महिलाएं हैं जो कपड़ों पर वार्षिक $\$ 500$ से कम खर्च करती हैं; समूह 2 में वे महिलाएं हैं जो कपड़ों पर वार्षिक $\$ 1000$ से अधिक खर्च करती हैं। मान लीजिए $p_1$ और $p_2$ क्रमशः इन दो समूहों में उन महिलाओं का अनुपात है जो मानती हैं कि कपड़े बहुत महंगे हैं। यदि समूह 1 से 1230 महिलाओं के यादृच्छिक नमूने में से 1009 और समूह 2 से 340 के यादृच्छिक नमूने में से 207 महिलाएं मानती हैं कि कपड़े बहुत महंगे हैं,(अ) $p_1-p_2$ का बिंदु आकलन दीजिए।",$0.2115$,$0.3256$,$0.1298$,$0.2732$,$0.3021$,$0.0997$,$0.2389$,$0.2654$,$0.1874$,$0.1543$,0,,math,hi
7852,"ग्वेन ने एक कागज पर नीचे दी गई संख्या का पैटर्न लिखा। 1, 5, 9, 13 ग्वेन के पैटर्न में अगले दो पद क्या होंगे?","17, 23","19, 25","19, 23","21, 23","17, 19","19, 21","15, 19","17, 21","15, 17","21, 25",7,,math,hi
7853,"उमी ने एक संख्या पैटर्न बनाया जो हर बार एक ही मात्रा जोड़कर अगली संख्या प्राप्त करता है। 20, 40, 60, 80, ... पैटर्न में आठवीं संख्या क्या होगी?",320,180,160,260,280,360,200,240,640,300,2,,math,hi
7854,बिल्ली का खाना $.47/पाउंड है। 6-पाउंड का एक थैला कितने का होगा?,$3.82,$2.97,$6.47,$12.77,$2.82,$1.47,$7.47,$8.22,$4.67,$5.02,4,,math,hi
7876,100 का तीन पंचमांश क्या है?,50,20,3,90,80,60,100,30,70,5,5,,math,hi
7880,3 <= n <= 11 वाले किन पूर्णांकों n के लिए केवल एक समूह क्रम n का होता है (समाकारिता तक)?,"केवल 3, 5, 7, और 11 के लिए","केवल 8, 9, 10, और 11 के लिए","केवल 4, 6, 8, और 10 के लिए","केवल 6, 7, 8, और 9 के लिए","केवल 3, 4, 5, और 6 के लिए","केवल 3, 5, 7, 9, और 11 के लिए","केवल 4, 5, 6, और 8 के लिए",सभी पूर्णांकों n के लिए जहाँ 3 <= n <= 11,ऐसे किसी भी पूर्णांक n के लिए नहीं,"केवल 5, 6, 7, 8, और 9 के लिए",0,,math,hi
7914,"n शीर्षों वाले एक पूर्ण ग्राफ की किनारों को 2 रंगों (लाल और नीला) से रंगने पर, वह न्यूनतम n क्या है जो या तो लाल में एक 4-क्लिक या नीले में एक 4-क्लिक की गारंटी देता है?",12,15,14,16,22,8,10,20,19,18,9,,math,hi
7918,"एक हेलीकॉप्टर जिसकी ऊंचाई s(t) = 300t - 4t^3 मीटर है, उसका t = 5 मिनट पर त्वरण मीटर/(मिनट^2) में ज्ञात करें।",100,240,180,150,60,-200,-60,-120,-180,-240,7,,math,hi
7930,\lim_{x \to 1} ((x - 1) sin((\π)/(x - 1)) का मान क्या होगा?,π,0,2π,1,अपरिभाषित,e,1/2,-π,1/π,-1,1,,math,hi
7935,"एक बल $\mathbf{F}=8 \mathbf{i}-6 \mathbf{j}+9 \mathbf{k}$ द्वारा किया गया कार्य ज्ञात करें जो एक वस्तु को बिंदु $(0,10,8)$ से बिंदु $(6,12,20)$ तक एक सीधी रेखा के साथ ले जाता है। दूरी मीटर में और बल न्यूटन में मापा जाता है।",144 $\mathrm{J}$,172 J,180 $\mathrm{J}$,168 J,132 J,160 $\mathrm{J}$,120 $\mathrm{J}$,156 J,200 J,210 J,0,,math,hi
7961,दो पूर्णांकों का लघुत्तम समापवर्त्य 60 है। प्रत्येक संख्या 12 से कम या बराबर है। दोनों संख्याओं का महत्तम समापवर्तक 2 है। वे दो संख्याएं क्या हैं?,5 और 12,12 और 15,6 और 12,4 और 8,3 और 9,8 और 10,6 और 10,2 और 10,2 और 6,10 और 12,9,,math,hi
7983,"एक धनात्मक पूर्णांक n को 'शक्तिशाली' कहा जाता है यदि, n के प्रत्येक अभाज्य गुणनखंड p के लिए, p^2 भी n का एक गुणनखंड है। एक शक्तिशाली संख्या का उदाहरण है",297,392,300,240,336,360,408,,,,1,,math,hi
7992,"एक शहर की आबादी में एक वायरस फैल रहा है, और वायरस से संक्रमित लोगों की संख्या हर 3 दिन में दोगुनी हो जाती है। यदि शहर में 1,000 लोग हैं, और 1 जनवरी को 10 लोगों को वायरस है, तो वह सबसे पहली तारीख क्या होगी जब पूरा शहर वायरस से संक्रमित हो जाएगा, यह मानते हुए कि एक वर्ष में 365 दिन हैं, और जनवरी महीने में 31 दिन हैं?",10 फरवरी,28 जनवरी,10 जनवरी,1 मार्च,15 जनवरी,31 जनवरी,10 मार्च,21 जनवरी,21 फरवरी,1 फरवरी,7,,math,hi
7994,-200 से 200 तक की 401 पूर्णांक संख्याओं में से कितनी संख्याएँ 13 से भाग करने पर शेषफल 5 देती हैं?,32,30,46,31,60,62,15,61,29,45,3,,math,hi
8001,"एक आयत जिसकी लंबाई $3x$ इंच और चौड़ाई $x + 5$ इंच है, जिसमें यह विशेषता है कि इसका क्षेत्रफल और परिमाप बराबर हैं, तो $x$ का मान क्या है?",\frac{3}{10},\frac{5}{2},\frac{10}{3},3,\frac{3}{2},1,\frac{1}{2},4,5,2,5,,math,hi
8016,$2/\pi*\prod_{k=1}^{\infty} \frac{(2*k)^2}{(2*k-1)(2*k+1)}$ का मान क्या है?,1.414,0.707,0.5,3.14,4.0,1.0,1.57,2.0,6.28,2.718,5,,math,hi
8023,शब्द *बनाना* के अक्षरों को शब्द की समरूपता तक कितने तरीकों से व्यवस्थित किया जा सकता है?,50,40,100,24,30,60,120,20,15,10,4,,math,hi
8032,"धनात्मक पूर्णांक N और N^2 दोनों आधार 10 में लिखे जाने पर समान चार अंकों abcd के क्रम से समाप्त होते हैं, जहाँ अंक a शून्येतर है। तीन अंकों की संख्या abc ज्ञात कीजिए।",491,254,625,812,368,789,937,673,123,456,6,,math,hi
8037,"मान लीजिए $P_5(x)$ साइन(x) फलन के लिए पाँचवीं डिग्री का टेलर बहुपद सन्निकटन है, जो x=0 पर केंद्रित है। साइन(1) के बहुपद सन्निकटन के लिए लाग्रांज त्रुटि क्या है?",0.02098,0.00198,0.000198,0.01998,0.0198,0.19898,0.0000198,0.198,0.0000298,0.00298,2,,math,hi
8055,"प्रतिरोधकों की एक खेप का औसत प्रतिरोध 200 ओम है जिसका मानक विचलन 5 ओम है, और प्रतिरोध सामान्य रूप से वितरित हैं। मान लीजिए कि यादृच्छिक रूप से चुने गए प्रतिरोधक का प्रतिरोध 194 ओम से कम है। इसका प्रतिरोध 188 ओम से अधिक होने की क्या प्रायिकता है?",0.93,0.07,0.20,0.30,0.35,0.12,0.99,0.65,0.50,0.80,0,,math,hi
8056,"एक टॉक शो संचालक ने हाल ही में बताया कि उनके प्रसारण के दौरान पूछे गए प्रश्न के जवाब में, उनके प्रचारित पते पर प्राप्त 2500 से अधिक विद्युत डाक संदेशों में से 82% ने बच्चों को मादक पदार्थ बेचने के दोषी पाए गए किसी भी व्यक्ति के लिए मृत्युदंड का समर्थन किया। यह क्या दर्शाता है?",सर्वेक्षण पक्षपातपूर्ण है क्योंकि इसमें केवल वे श्रोता शामिल हैं जिनके पास विद्युत डाक की सुविधा है।,यदि उन्होंने नियंत्रण समूह का उपयोग किया होता तो सर्वेक्षण अधिक सार्थक होता।,सर्वेक्षण सटीक है क्योंकि इसमें बड़ी संख्या में प्रतिक्रियाएं शामिल हैं।,यदि उन्होंने प्रतिक्रिया देने वाले 2500 श्रोताओं में से यादृच्छिक नमूना चुना होता तो सर्वेक्षण अधिक सार्थक होता।,सर्वेक्षण मान्य है क्योंकि यह कार्यक्रम के श्रोताओं की राय का प्रतिनिधित्व करता है।,यदि उन्होंने अपने दृष्टिकोण से असहमत श्रोताओं को शामिल किया होता तो सर्वेक्षण अधिक सार्थक होता।,स्वैच्छिक प्रतिक्रिया पक्षपात के कारण सर्वेक्षण अर्थहीन है।,सर्वेक्षण दर्शाता है कि संचालक के अधिकांश श्रोता मादक पदार्थ विक्रेताओं के लिए मृत्युदंड का समर्थन करते हैं।,,,6,,math,hi
8084,"एक छह फलक वाला पासा जाली है: किसी भी सम संख्या के आने की संभावना किसी भी विषम संख्या के आने की संभावना से दोगुनी है। यदि इस पासे को दो बार फेंका जाए, तो पहली बार 5 और दूसरी बार 6 आने की संभावना क्या होगी?",1/27,2/81,1/9,1/18,2/9,3/81,2/27,1/81,3/27,2/18,1,,math,hi
8086,"मान लें I != A != -I, जहाँ I एक इकाई मैट्रिक्स है और A एक वास्तविक 2 x 2 मैट्रिक्स है। यदि A = A^(-1), तो A का ट्रेस है",0.5,0,3,1,-2,2,-4,4,-3,-1,1,,math,hi
8088,"मान लें कि T: R^2 -> R^2 एक रैखिक रूपांतरण है जो बिंदु (1, 2) को (2, 3) में और बिंदु (-1, 2) को (2, -3) में मैप करता है। तब T बिंदु (2, 1) को किसमें मैप करेगा","(2, 5)","(4, -3)","(0, 0)","(3, 2)","(5, -1)","(-2, 1)","(1, 6)","(-1, 4)","(-3, 2)","(-4, 3)",6,,math,hi
8097,"एक ठोस का आधार x^2 = 4y और रेखा y = 2 से परिबद्ध क्षेत्र है, और y-अक्ष के लंबवत प्रत्येक समतल काट एक वर्ग है। ठोस का आयतन है",8,32,36,28,48,44,16,40,24,20,1,,math,hi
8107,"मान लीजिए $p$, $q$, और $r$ स्थिरांक हैं। समीकरण $(x-p)(x-q) = (r-p)(r-q)$ का एक हल $x=r$ है। $p$, $q$, और $r$ के पदों में दूसरा हल ज्ञात कीजिए।",r-p-q,p+q-r,p-q-r,pq-r,(p+q)/r,pqr,p*q/r,p*r/q,q*r/p,(p*q)/r,1,,math,hi
8114,"1000 लोगों के एक समूह में, कम से कम कितने लोगों का जन्मदिन एक ही दिन होना चाहिए?",कम से कम 50 लोग,कम से कम 23 लोग,कम से कम 100 लोग,20,कम से कम 5 लोग,10,कम से कम 367 लोग,2,कम से कम 1 लोग,3,9,,math,hi
8165,"प्रतिगमन रेखा के लिए, अवशेषों के बारे में निम्नलिखित में से कौन सा कथन सत्य है?",अवशेषों का योग हमेशा एक होता है।,"यदि सहसंबंध 0 है, तो अवशेष प्लॉट में एक विशिष्ट पैटर्न होगा।","अवशेष जितने बड़े होंगे, रैखिक मॉडल उतना बेहतर होगा।",अवशेष हमेशा ऋणात्मक होते हैं।,"यदि सहसंबंध 1 है, तो अवशेष प्लॉट में एक विशिष्ट पैटर्न होगा।",अवशेष प्लॉट हमेशा एक सीधी रेखा होगी।,प्रभावशाली स्कोर में बड़े अवशेष होते हैं।,अवशेषों का माध्य हमेशा शून्य होता है।,"यदि रैखिक मॉडल अच्छा है, तो धनात्मक अवशेषों की संख्या ऋणात्मक अवशेषों की संख्या के बराबर होगी।",अवशेष कभी भी शून्य नहीं हो सकते।,7,,math,hi
8170,4/7 + 2/7 ज्ञात करें।,2/7,6/7,14/28,6/14,1/2,8/14,7/14,10/7,8/49,4/14,1,,math,hi
8182,सटीक उत्तर ज्ञात करें: 365 + 56,320,330,400,421,300,311,410,315,309,405,3,,math,hi
8187,"कथन 1 | f : X → Y सतत है और X संहत है। f को एक समान सतत होना चाहिए। कथन 2 | यदि f(x), g(x) : R → R सर्वत्र अवकलनीय हैं तो f(g(x)) को सर्वत्र अवकलनीय होना चाहिए।","लागू नहीं, लागू नहीं","सत्य, असत्य","दोनों कथन लागू होते हैं, लेकिन निश्चित रूप से सत्य या असत्य के रूप में वर्गीकृत नहीं किया जा सकता","असत्य, लागू नहीं","असत्य, सत्य","सत्य, लागू नहीं","असत्य, असत्य","लागू नहीं, सत्य","लागू नहीं, असत्य","सत्य, सत्य",9,,math,hi
8213,"उस त्रिभुज का क्षेत्रफल ज्ञात कीजिए जिसकी शीर्षलंब की लंबाई 10, 12 और 15 है।",56\sqrt{15},60\sqrt{7},240\sqrt{7}/7,48\sqrt{15},120\sqrt{15},180\sqrt{7}/7,60\sqrt{7}/7,48\sqrt{7},100\sqrt{7},240\sqrt{7},2,,math,hi
8217,9 लोगों के एक समूह को 3-3 लोगों की 3 समितियों में बांटा जाता है। समितियां सदस्यों के अलावा समान हैं। यह कितने तरीकों से किया जा सकता है?,504,210,126,300,360,168,280,240,420,320,6,,math,hi
