question_id,question,option_0,option_1,option_2,option_3,option_4,option_5,option_6,option_7,option_8,option_9,answer_index,cot_content,category,dialect
8389,مندرجہ ذیل میں سے کون سا تجربہ اور مشاہداتی مطالعہ کے درمیان بنیادی فرق ہے؟,ایک تجربے میں، محقق کو متغیرات پر کوئی کنٹرول نہیں ہوتا؛ مشاہداتی مطالعہ میں، محقق متغیرات میں ترمیم کر سکتا ہے۔,تجربات صرف انسانی افراد پر کیے جاتے ہیں؛ مشاہداتی مطالعات غیر انسانی افراد پر بھی کیے جا سکتے ہیں۔,مشاہداتی مطالعات لیبارٹری کے ماحول میں کیے جاتے ہیں، جبکہ تجربات کسی بھی ماحول میں کیے جا سکتے ہیں۔,تجربات لازمی طور پر دوہرے اندھے (ڈبل بلائنڈ) ہونے چاہئیں؛ مشاہداتی مطالعات کو ایسا ہونے کی ضرورت نہیں ہے۔,ایک تجربے میں، محقق مداخلت کیے بغیر مشاہدہ کرتا ہے؛ مشاہداتی مطالعہ میں، محقق ماحول میں ترمیم کرتا ہے۔,تجربات صرف ایک بار کیے جا سکتے ہیں؛ مشاہداتی مطالعات دہرائے جا سکتے ہیں۔,تجربات میں لازمی طور پر بے ترتیب علاج اور کنٹرول گروپس استعمال کیے جاتے ہیں؛ مشاہداتی مطالعات میں بھی علاج اور کنٹرول گروپس استعمال کیے جاتے ہیں، لیکن ان کو بے ترتیب ہونے کی ضرورت نہیں ہے۔,تجربات میں مقداری ڈیٹا شامل ہوتا ہے؛ مشاہداتی مطالعات میں کیفیاتی ڈیٹا شامل ہوتا ہے۔,ایک تجربے میں، محقق کسی متغیر میں ترمیم کرتا ہے تاکہ اس کا ردعمل متغیر پر اثر دیکھ سکے؛ مشاہداتی مطالعہ میں، وہ صرف مشاہدہ کرتا ہے اور مشاہدات کو ریکارڈ کرتا ہے۔,تجربات کے لیے فرضیہ کی ضرورت ہوتی ہے؛ مشاہداتی مطالعات کے لیے فرضیہ کی ضرورت نہیں ہوتی۔,8,,math,ur
8415,25 سوٹ کیس ہیں، جن میں سے 5 خراب ہیں۔ تین سوٹ کیس بے ترتیب طور پر منتخب کیے جاتے ہیں۔ اس بات کا امکان کیا ہے کہ ٹھیک 2 خراب ہوں؟,2/50,1/25,1/30,3/75,4/100,2/23,12/125,5/125,2/69,1/10,5,,math,ur
8417,فرض کریں x_1 = 1 اور x_(n+1) = sqrt(3+2x_n) تمام مثبت اعداد صحیح n کے لیے۔ اگر یہ فرض کیا جائے کہ {x_n} مجموعی طور پر ہم آہنگ ہوتا ہے، تو lim x_n =,sqrt(5),e,3,5,1,0,sqrt(2),2,sqrt(7),sqrt(3),2,,math,ur
8451,فرض کریں کہ g(x)، f(x) = x + cos(x) کا معکوس ہے۔ g'(1) کی قیمت کیا ہوگی؟,sqrt(2),-2,1,0,-1/2,-sqrt(2),3,2,1/2,-1,2,,math,ur
8486,فرمیٹ کے قضیے (Fermat's theorem) کا استعمال کرتے ہوئے، 3^47 کو 23 سے تقسیم کرنے پر باقی معلوم کریں۔,10,2,8,4,5,7,3,9,1,6,3,,math,ur
8518,999 - 103 کا تخمینہ لگائیں۔ یہ فرق کن اعداد کے درمیان ہے؟,500 اور 700,200 اور 400,700 اور 900,"1,300 اور 1,500","800 اور 1,000","900 اور 1,100",400 اور 600,100 اور 300,600 اور 800,"1,000 اور 1,200",2,,math,ur
8560,کثیر الحدی $x^3 - Ax + 15$ کے تین حقیقی جڑیں ہیں۔ ان میں سے دو جڑوں کا مجموعہ 5 ہے۔ |A| کی قیمت کیا ہے؟,19.0,17.0,25.0,23.0,18.0,20.0,22.0,24.0,21.0,26.0,6,,math,ur
8590,ایک گردے کی ڈائلیسس مرکز وقتاً فوقتاً اپنے آلات کے نمونوں کی جانچ کرتا ہے اور اگر ریڈنگز مطلوبہ حد سے کافی زیادہ ہٹ جائیں تو بڑے پیمانے پر دوبارہ کیلیبریشن کرتا ہے۔ اسی طرح، ایک کپڑے کا کارخانہ وقتاً فوقتاً اسمبلی لائن سے آنے والے تولیوں کے سائز کی جانچ کرتا ہے اور اگر پیمائش مطلوبہ ہدف سے کافی زیادہ ہٹ جائے تو پیداوار روک دیتا ہے۔ دونوں صورتوں میں، ہمارے پاس ایک نل مفروضہ (null hypothesis) ہے کہ آلات تسلی بخش طریقے سے کام کر رہے ہیں۔ ہر صورت کے لیے، کون سی زیادہ سنگین تشویش ہے، ٹائپ I یا ٹائپ II غلطی؟,ڈائلیسس مرکز: ٹائپ II غلطی، تولیہ بنانے والا: ٹائپ II غلطی,ڈائلیسس مرکز: نہ ٹائپ I اور نہ ہی ٹائپ II غلطی، تولیہ بنانے والا: ٹائپ II غلطی,ڈائلیسس مرکز: ٹائپ I غلطی، تولیہ بنانے والا: ٹائپ II غلطی,ڈائلیسس مرکز: ٹائپ II غلطی، تولیہ بنانے والا: ٹائپ I غلطی,ڈائلیسس مرکز: ٹائپ I اور ٹائپ II دونوں غلطیاں، تولیہ بنانے والا: ٹائپ I غلطی,ڈائلیسس مرکز: ٹائپ I غلطی، تولیہ بنانے والا: ٹائپ I غلطی,ڈائلیسس مرکز: نہ ٹائپ I اور نہ ہی ٹائپ II غلطی، تولیہ بنانے والا: ٹائپ I غلطی,ڈائلیسس مرکز: ٹائپ I اور ٹائپ II دونوں غلطیاں، تولیہ بنانے والا: ٹائپ II غلطی,ڈائلیسس مرکز: ٹائپ I غلطی، تولیہ بنانے والا: نہ ٹائپ I اور نہ ہی ٹائپ II غلطی,ڈائلیسس مرکز: ٹائپ II غلطی، تولیہ بنانے والا: نہ ٹائپ I اور نہ ہی ٹائپ II غلطی,3,,math,ur
8600,دی ہوئی مساوات 18.5 dol over m gal = 3.60 dol over 7.5 gal کو حل کریں۔ اگر ضروری ہو تو جواب کو سینکڑے کے قریب ترین عدد تک روند کریں۔,45.67,28.14,36.99,32.54,8.86,38.44,40.88,33.21,42.25,50.32,5,,math,ur
8609,"ایک سائنس دان نے دو قسم کے وہیلوں کے نقل مکانی کے طریقوں کا مطالعہ کیا۔ ہمپ بیک وہیل نے 28 دنوں میں 2,240 میل کا سفر طے کیا۔ گرے وہیل نے 32 دنوں میں 2,368 میل کا سفر طے کیا۔ اگر ہمپ بیک وہیل اسی رفتار سے 32 دنوں تک سفر کرتے، تو وہ گرے وہیلوں سے کتنے زیادہ میل سفر کرتے؟",64,408,128,320,280,96,192,160,256,224,6,,math,ur
8640,8 افراد کو 5 یکساں گول میزوں پر کتنے طریقوں سے بٹھایا جا سکتا ہے؟ ہر میز پر کم از کم 1 شخص کو بیٹھنا چاہیے۔,1460,2560,1860,1760,1960,2260,2160,1560,1660,2060,4,,math,ur
8647,5.4-19. ایک ہوٹل کا دربان تین مختلف جوڑوں کے لیے تین ٹیکسی کیبز حاصل کرنے کی کوشش کر رہا ہے۔ خالی کیبز کے آنے کی تقسیم نمائی (exponential distribution) ہے جس کا اوسط 2 منٹ ہے۔ یہ فرض کرتے ہوئے کہ یہ آمد آزادانہ ہے، اس بات کا امکان کیا ہے کہ دربان تینوں جوڑوں کو 6 منٹ کے اندر ٹیکسی میں بٹھا دے گا؟,$0.7234$,$0.5768$,$0.5012$,$0.6523$,$0.3894$,$0.6981$,$0.9142$,$0.8413$,$0.4321$,$0.3215$,1,,math,ur
7333,Los die vergelyking 14 = w + 23 op.,9,37,−23,14,−14,0,−9,−37,23,,6,,math,af
7344,Die kortste afstand vanaf die kromme xy = 8 na die oorsprong is,4,2sqrt(2),sqrt(8),sqrt(4),1,4sqrt(2),8,2,16,6,0,,math,af
7345,"Laat V die reële vektorruimte wees van alle reële 2 x 3 matrikse, en laat W die reële vektorruimte wees van alle reële 4 x 1 kolomvektore. As T 'n lineêre transformasie is van V na W, wat is die dimensie van die deelruimte kern van T?",5,3,9,4,2,0,7,6,1,8,4,,math,af
7350,Laat $n$ die produk wees van die twee kleinste 3-syfer priemgetalle. Bepaal die som van die syfers van $n$.,8,9,14,3,10,18,11,15,6,12,0,,math,af
7352,"Veronderstel dat $f(x)$ 'n polinoom is met graad $6$ en $g(x)$ 'n polinoom is met graad $3$. As $h(x)$ ook 'n polinoom is sodat $f(g(x)) + g(h(x)) + h(f(x))$ 'n polinoom van graad $36$ is, wat is die graad van die polinoom $h$?",3,21,6,9,30,72,12,15,24,18,2,,math,af
7364,Wat is die kleinste moontlike positiewe heelgetal-waarde van $n$ sodat $\sqrt{18\cdot n \cdot 34}$ 'n heelgetal is?,4,3,1,18,51,17,6,34,68,2,5,,math,af
7368,Hoeveel driehoeke is daar waarvan al die sye heelgetalle is en waarvan die maksimum sylengte gelyk is aan 11?,45,36,48,33,50,55,24,42,30,60,1,,math,af
7377,Die produk van twee van die vier wortels van die kwartiese vergelyking x^4 - 18x^3 +kx^2 + 200x - 1984 = 0 is -32. Bepaal die waarde van k.,150,45,86,110,72,120,103,98,54,64,2,,math,af
7379,"Vir a\geq 0, definieer ons $S_a={x | dist(x, S) \leq a}$, waar $dist(x,S)=inf_{y\in S}||x-y||$. Veronderstel S is konveks. Is S_a konveks? Gee 1 terug vir ja en 0 vir nee.",Ongedefinieerd,0.0,Geen van bogenoemde,1.0,,,,,,,3,,math,af
7402,Bepaal of die polinoom in Z[x] aan 'n Eisenstein-kriterium vir onherleibaarheid oor Q voldoen. x^2 - 12,"Ja, met p=4.","Nee, want die polinoom is herleibaar.","Ja, met p=1.","Nee, want die polinoom voldoen nie aan die Eisenstein-kriterium nie.",Nee.,"Ja, met p=12.","Ja, met p=3.","Ja, met p=5.","Ja, met p=6.","Ja, met p=2.",6,,math,af
7416,"Die verband tussen die verkoopprys van 'n motor (in $1,000) en die ouderdom daarvan (in jare) word beraam uit 'n ewekansige steekproef van motors van 'n spesifieke model. Die verband word deur die volgende formule gegee: Verkoopprys = 15.9 – 0.983 (ouderdom) Watter van die volgende kan ons uit hierdie vergelyking aflei?","Vir elke jaar wat die motor ouer word, daal die verkoopprys met ongeveer $983.","Die gemiddelde koste van 'n nuwe motor is $9,830.","Die gemiddelde koste van 'n nuwe motor is $15,900.","Vir elke jaar wat die motor ouer word, daal die verkoopprys met ongeveer 9.83 persent.","Vir elke jaar wat die motor ouer word, styg die verkoopprys met ongeveer $983.","Vir elke jaar wat die motor ouer word, daal die verkoopprys met ongeveer $159.","Vir elke jaar wat die motor ouer word, styg die verkoopprys met ongeveer $1,590.",Die gemiddelde koste van 'n nuwe motor is $983.,"Vir elke jaar wat die motor ouer word, bly die verkoopprys dieselfde.","Vir elke jaar wat die motor ouer word, daal die verkoopprys met ongeveer $1,590.",0,,math,af
7464,"Twee getalle wat bymekaar getel word, is 19. Hul produk is 70. Wat is die twee getalle?","5, 14","4, 15","1, 18","9, 10","12, 7","2, 17","3, 16","7, 10","8, 11","6, 13",0,,math,af
7469,"Veronderstel C is 'n kompakte konvekse versameling in 'n lineêre genormeerde ruimte, en laat T: C → C 'n kontinue afbeelding wees. Dan bestaan daar 'n vaste punt van T in C. Is dit korrek? Antwoord 1 vir ja en 0 vir nee.",1.0,2.5,-0.5,1.5,-1.0,0.5,0.0,2.0,-2.0,3.0,0,,math,af
7493,"'n Sekere veer-massa-stelsel voldoen aan die aanvanklike waardeprobleem\n$$\nu^{\prime \prime}+\\frac{1}{4} u^{\prime}+u=k g(t), \\quad u(0)=0, \\quad u^{\prime}(0)=0\n$$\nwaar $g(t)=u_{3 / 2}(t)-u_{5 / 2}(t)$ en $k>0$ 'n parameter is.\nVeronderstel $k=2$. Vind die tyd $\\tau$ waarna $|u(t)|<0.1$ vir alle $t>\\tau$.",27.8924,25.6773,30.7654,24.5567,19.4689,32.8495,20.5426,28.6891,34.1256,22.3147,1,,math,af
7497,"5.6-9. In Voorbeeld 5.6-4, bereken $P(1.7 \leq Y \leq 3.2)$ met $n=4$ en vergelyk jou antwoord met die normale benadering van hierdie waarskynlikheid.",$0.7254$,$0.6749$,$0.6182$,$0.7035$,$0.7891$,$0.9524$,$0.5918$,$0.4876$,$0.5603$,$0.8421$,1,,math,af
7509,Vind die generator vir die eindige liggaam Z_11.,2,5,10,6,4,3,8,7,1,9,0,,math,af
7519,"Veronderstel X en Y is ewekansige veranderlikes met μx = 32, σx = 5, μy = 44, en σy = 12. Gegewe dat X en Y onafhanklik is, wat is die gemiddelde en standaardafwyking van die ewekansige veranderlike X + Y?","μx+y = 72, σx+y = 12","μx+y = 80, σx+y = 15","μx+y = 76, σx+y = 8.5","μx+y = 76, σx+y = 20","μx+y = 76, σx+y = 13","μx+y = 38, σx+y = 17","μx+y = 76, σx+y = 17","μx+y = 68, σx+y = 13","μx+y = 70, σx+y = 17","μx+y = 76, σx+y = 19",4,,math,af
7521,"Die gemiddelde daaglikse aanvraag vir brood by 'n gewilde bakkery is 2,500 brode, met 'n standaardafwyking van 225 brode. Elke oggend bak die bakkery 3,000 brode. Wat is die waarskynlikheid dat die bakkery vandag uit brood sal raak? Aanvaar dat die gemiddelde daaglikse aanvraag vir brood by hierdie bakkery normaal versprei is.",0.9869,0.5234,0.6875,0.0132,0.3500,0.4589,0.8333,0.2314,0.7500,0.1667,3,,math,af
7534,Skryf die priemfaktorisering van 77. Gebruik eksponente waar moontlik.,7^2 • 11^2,11^2 • 13,7 • 13^2,7 • 11 • 13,7 • 11,7^2 • 13,7^2 • 11,7 • 11^2 • 13,11 • 13,7^3 • 11,4,,math,af
7555,"Veronderstel $f(x)$ is 'n funksie met hierdie eienskap: Vir alle reële getalle $a$ en $b$ sodanig dat $a<b$, lê die gedeelte van die grafiek van $y=f(x)$ tussen $x=a$ en $x=b$ onder die lynsegment waarvan die eindpunte $(a,f(a))$ en $(b,f(b))$ is. ('n Funksie met hierdie eienskap word streng konveks genoem.) Gegee dat $f(x)$ deur $(-2,5)$ en $(2,9)$ gaan, wat is die reeks van alle moontlike waardes vir $f(1)$? Druk jou antwoord uit in intervalnotasie.","(-inf, 5)","(-inf, 7)","(-inf, 3)","(-inf, 11)","(-inf, 9)","(-inf, 12)","(-inf, 6)","(-inf, 10)","(-inf, 4)","(-inf, 8)",9,,math,af
7560,Watter waarde van $N$ bevredig $rac{4^{(3^3)}}{(4^3)^3} = 2^N$?,34,64,36,18,9,81,27,72,45,54,2,,math,af
7566,Ses 6-kantige dobbelstene word gegooi. Wat is die waarskynlikheid dat drie van die dobbelstene priemgetalle wys en die res saamgestelde getalle wys?,\frac{5}{55},\frac{5}{54},\frac{125}{7776},\frac{3}{18},\frac{125}{2916},\frac{5}{36},\frac{5}{16},\frac{10}{54},\frac{1}{6},\frac{125}{3888},1,,math,af
7576,Is die kumulatiewe verdelingsfunksie van die standaard Gaussiese verdeling $F(x)=1/\sqrt{2 \pi} \int_{-\infty}^x e^{-t^2/2} dt$ log-konkaaf? Gee 1 terug vir ja en 0 vir nee.,2.5,-1.0,2.0,1.5,-0.5,0.0,1.0,-2.0,0.5,3.0,6,,math,af
7598,"vir die matriks $A=(\begin{array}{rrrrr} 1 & 2 & 3 & 4 & -3 \1 & 2 & 0 & -5 & 1 \2 & 4 & -3 & -19 & 6 \3 & 6 & -3 & -24 & 7\end{array})$, wat is die ry-rang en kolom-rang? gee die twee getalle as 'n lys.","[1, 1]","[3, 4]","[4, 4]","[2, 4]","[2, 3]","[3, 3]","[4, 2]","[2, 2]","[4, 3]","[3, 2]",7,,math,af
7610,"7.3-5. Om die proporsie, $p$, van 'n groot klas eerstejaars universiteitstudente te beraam wat hoërskool GPA's van 3.2 tot 3.6, insluitend, gehad het, is 'n steekproef van $n=50$ studente geneem. Daar is bevind dat $y=9$ studente in hierdie interval val.
(a) Gee 'n puntberaming van $p$.",$0.1000$,$0.1600$,$0.1200$,$0.2000$,$0.2200$,$0.1400$,$0.3000$,$0.2500$,$0.2800$,$0.1800$,9,,math,af
7613,Laat $A$ en $B$ onafhanklike gebeurtenisse wees met $P(A)=$ 0.7 en $P(B)=0.2$. Bereken $P(A \cap B)$.,0.28,0.9,0.7,0.1,0.56,0.04,0.14,0.5,0.2,0.35,6,,math,af
7617,Vind die karakteristiek van die ring Z_3 x 3Z.,24,12,30,21,15,36,3,9,6,0,9,,math,af
7647,"Wat is die kwosiënt van 1,248 / 7?",168 met res 2,178 met res 2,169 met res 3,178 met res 0,177 met res 8,178 met res 3,177 met res 7,178 met res 4,177 met res 9,178 met res 1,1,,math,af
7662,Wat is die grootste gemene faktor van 252 en 96?,24,48,30,12,6,36,15,21,5,18,3,,math,af
7671,"Wat is die determinant van matriks [[0, 1, 2], [7, 8, 3], [6, 5, 4]]?",0,24,-12,36,-48,72,-60,-24,-36,60,8,,math,af
7672,Gebruik die Trapesiumreël om die benadering van $\int_0^{\pi} sin^2(x)dx$ te bereken. Gee die benaderde desimale waarde.,1.414214,1.000000,0.785398,1.570796,1.234567,3.000000,3.141592,2.718282,2.345678,2.000000,3,,math,af
7675,"Hoeveel heelgetalle tussen 1 (ingesluit) en 100 (ingesluit) is deelbaar deur óf 2, 3, of 5?",82,60,80,68,74,72,85,50,78,66,4,,math,af
7681,Op hoeveel maniere kan 'n komitee van 2 mans en 3 vrouens gekies word uit 'n groep van 6 mans en 8 vrouens?,1500,1000,1200,1100,720,960,400,500,840,650,8,,math,af
7711,"'n Tipiese roulettewiel wat in 'n casino gebruik word, het 38 gleuwe wat onderskeidelik $1,2,3, \ldots, 36,0,00$ genommer is. Die 0 en 00 gleuwe is groen gekleur. Die helfte van die oorblywende gleuwe is rooi en die helfte is swart. Verder is die helfte van die heelgetalle tussen 1 en 36 insluitend onewe, die helfte is ewe, en 0 en 00 word gedefinieer as nóg onewe nóg ewe. 'n Bal word rondom die wiel gerol en land in een van die gleuwe; ons aanvaar dat elke gleuf 'n gelyke waarskynlikheid van $1 / 38$ het, en ons stel belang in die nommer van die gleuf waarin die bal val. Laat $A=\{0,00\}$. Gee die waarde van $P(A)$.",$\frac{1}{19}$,$\frac{1}{76}$,$\frac{20}{38}$,$\frac{2}{38}$,$\frac{3}{38}$,$\frac{4}{38}$,$\frac{36}{38}$,$\frac{1}{38}$,$\frac{1}{2}$,$\frac{18}{38}$,3,,math,af
7729,"'n Skoolraad van 'n groot skooldistrik stel 'n nuwe dragkode vir studente voor. Sommige studente voel dat hierdie dragkode onregverdig op vroulike studente gemik is. Om vas te stel of daar 'n verskil is tussen seuns en meisies in hul teenkanting teen die nuwe dragkode, voer hulle 'n opname uit onder 60 ewekansig geselekteerde manlike en 70 ewekansig geselekteerde vroulike hoërskoolleerders in die distrik. Hulle vind dat 66 vroulike studente teen die dragkode gekant is en 50 manlike studente teen die dragkode gekant is. Watter van die volgende verduidelik waarom 'n twee-proporsie z-toets nie toepaslik is nie?",Daar is geen alternatiewe hipotese voorgestel vir hierdie toets nie.,Die aantal suksesse en die aantal mislukkings vir die twee groepe is nie almal groot genoeg nie.,Die vorms van die populasieverdelings is nie bekend nie.,Die z-toets is nie ontwerp vir proporsies nie.,Die steekproefgroottes is te klein.,Die steekproefgroottes is verskillend.,Die steekproef is nie ewekansig geselekteer nie.,"Die studente wat teen die dragkode gekant is, verteenwoordig nie die hele populasie nie.",Die steekproefgroottes is te groot.,Die proporsies van manlik en vroulik is nie gelyk nie.,1,,math,af
7733,"Die Departement van Gesondheid beplan om die loodvlak in 'n spesifieke park te toets. Omdat 'n hoë loodvlak skadelik is vir kinders, sal die park gesluit word indien die loodvlak die toelaatbare limiet oorskry. Die departement kies lukraak verskeie plekke in die park, neem grondmonsters van daardie plekke, en toets die monsters vir hul loodvlakke. Watter van die volgende besluite sou die gevolg wees van 'n tipe I-fout?",Die park oop hou wanneer die loodvlakke binne die toelaatbare limiet is,Die park sluit gebaseer op 'n voorspelde toekomstige loodvlak-toename,Die park oop hou wanneer die loodvlakke die toelaatbare limiet oorskry,Ander parke sluit wanneer hul loodvlakke binne die toelaatbare limiet is,Die park sluit wanneer die loodvlakke die toelaatbare limiet oorskry,Glad nie die loodvlakke toets nie en die park sluit,Ander parke oop hou wanneer hul loodvlakke die toelaatbare limiet oorskry,Die toetsresultate ignoreer en die park oop hou ongeag die loodvlakke,Die park sluit wanneer die loodvlakke binne die toelaatbare limiet is,Die park sluit gebaseer op loodvlakke van 'n ander park,8,,math,af
7734,In 'n groep van 10 tellings word die grootste telling met 40 punte verhoog. Wat sal met die gemiddeld gebeur?,Dit sal dieselfde bly.,Dit sal met 30 punte verhoog.,Dit sal met 10 punte verhoog.,Dit sal met 10 punte verlaag.,Dit sal onveranderd bly as die ander tellings ook met 40 punte verhoog.,Dit sal met 20 punte verhoog.,Dit sal met 4 punte verlaag.,Dit sal met 40 punte verlaag.,Dit sal met 40 punte verhoog.,Dit sal met 4 punte verhoog.,9,,math,af
7752,Watter verhouding kan 'n eweredigheid vorm met 3 oor 8?,24 oor 64,15 oor 48,18 oor 56,18 oor 40,,,,,,,0,,math,af
7762,'n Winkel het 8 vistenks wat elk 40 liter water bevat. Wat is die totale aantal liters water in al die vistenks?,400,380,280,300,360,340,5,420,320,48,8,,math,af
7783,"Ses positiewe heelgetalle word op die vlakke van 'n kubus geskryf. Elke hoekpunt word gemerk met die produk van die drie getalle op die vlakke aangrensend aan die hoekpunt. As die som van die getalle op die hoekpunte gelyk is aan $1001$, wat is die som van die getalle wat op die vlakke geskryf is?",36,31,15,20,13,18,27,24,1001,45,1,,math,af
7794,"Veronderstel dat ons twee regverdige 6-kantige dobbelstene gooi. Wat is die waarskynlikheid dat die som van die twee getalle wat gegooi word, gelyk aan 4 is?",\frac{3}{12},\frac{1}{6},\frac{2}{12},\frac{1}{9},\frac{1}{2},\frac{1}{18},\frac{1}{12},\frac{1}{3},\frac{1}{4},\frac{1}{8},6,,math,af
7827,"Laat X_1, X_2,... onafhanklike veranderlikes wees wat elk waardes +1 of -1 aanneem met waarskynlikhede 1/2 en 1/2. Dit is bekend dat $\sqrt{3/n^3}*\sum_{k=1}^n k*X_k$ in verspreiding konvergeer na 'n normale verdeling N(a,b) wanneer n na oneindigheid neig. Hier is a die verwagte waarde en b die variansie. Wat is die waardes van a en b? Gee die antwoorde as 'n lys. Byvoorbeeld, as a=2, b=100, gee [2,100].","[2, 0]","[0, 1]","[2, 1]","[1, 1]","[1, 0]","[0, 0]","[0, 1/2]","[1, 2]","[0, 2]","[0, 3]",1,,math,af
7828,"Vir die volgende funksies, watter is begrensde hele funksies? 1. f(x)=0; 2. f(x)= 1+i; 3. f(x)=sin(x); 4. f(x)=min{|cos(x)|,1}. Hier is i=\sqrt{-1} en $|\cdot|$ is die norm van 'n komplekse getal. Gee die nommers van die antwoorde as 'n lys.","[1, 2]","[2, 4]","[3, 4]","[1, 2, 3]","[1, 3, 4]","[1, 4]",[4],"[1, 3]",[3],"[2, 3]",0,,math,af
7829,"Vind die kleinste positiewe heelgetal wat 'n res van 1 lewer wanneer dit deur 2 gedeel word, 'n res van 2 wanneer dit deur 3 gedeel word, 'n res van 3 wanneer dit deur 4 gedeel word, 'n res van 4 wanneer dit deur 5 gedeel word, en 'n res van 5 wanneer dit deur 6 gedeel word.",59,91,101,121,65,143,50,72,61,119,0,,math,af
7833,"Gebruik Stokes se Stelling om $\int_C \mathbf{F} \cdot d \mathbf{r}$ te evalueer, waar $\mathbf{F}(x, y, z)=x y \mathbf{i}+y z \mathbf{j}+z x \mathbf{k}$, en $C$ is die driehoek met hoekpunte $(1,0,0),(0,1,0)$, en $(0,0,1)$, wat teen-kloksgewys georiënteer is soos van bo gesien.",$-\frac{1}{2}$,$\frac{1}{2}$,$0$,$\frac{3}{4}$,$\frac{1}{4}$,$-1$,$\frac{1}{3}$,$\frac{2}{3}$,$-\frac{1}{4}$,$-\frac{1}{3}$,0,,math,af
7835,"7.3-9. Beskou die volgende twee groepe vroue: Groep 1 bestaan uit vroue wat jaarliks minder as $\$ 500$ aan klere bestee; Groep 2 bestaan uit vroue wat jaarliks meer as $\$ 1000$ aan klere bestee. Laat $p_1$ en $p_2$ onderskeidelik gelyk wees aan die proporsies vroue in hierdie twee groepe wat glo dat klere te duur is. As 1009 uit 'n ewekansige steekproef van 1230 vroue uit groep 1 en 207 uit 'n ewekansige steekproef van 340 uit groep 2 glo dat klere te duur is,\n(a) Gee 'n puntberaming van $p_1-p_2$.",$0.2115$,$0.3256$,$0.1298$,$0.2732$,$0.3021$,$0.0997$,$0.2389$,$0.2654$,$0.1874$,$0.1543$,0,,math,af
7852,"Gwen het die getalpatroon hieronder op 'n stuk papier geskryf. 1, 5, 9, 13 Wat is die volgende twee terme in Gwen se patroon?","17, 23","19, 25","19, 23","21, 23","17, 19","19, 21","15, 19","17, 21","15, 17","21, 25",7,,math,af
7853,"Umi het die volgende getalpatroon geskep deur elke keer dieselfde hoeveelheid by te tel om die volgende getal te kry. 20, 40, 60, 80, ... Wat sal die agtste getal in die patroon wees?",320,180,160,260,280,360,200,240,640,300,2,,math,af
7854,Katvoedsel kos $.47/lb. Hoeveel kos 'n 6-lb sak?,$3.82,$2.97,$6.47,$12.77,$2.82,$1.47,$7.47,$8.22,$4.67,$5.02,4,,math,af
7876,Wat is drie vyfdes van 100?,50,20,3,90,80,60,100,30,70,5,5,,math,af
7880,Vir watter heelgetalle n sodanig dat 3 <= n <= 11 is daar slegs een groep van orde n (tot op isomorfisme)?,"Vir slegs 3, 5, 7, en 11","Vir slegs 8, 9, 10, en 11","Vir slegs 4, 6, 8, en 10","Vir slegs 6, 7, 8, en 9","Vir slegs 3, 4, 5, en 6","Vir slegs 3, 5, 7, 9, en 11","Vir slegs 4, 5, 6, en 8",Vir alle heelgetalle n sodanig dat 3 <= n <= 11,Vir geen sodanige heelgetal n nie,"Vir slegs 5, 6, 7, 8, en 9",0,,math,af
7914,"Wanneer ons die kante van 'n volledige grafiek met n punte in 2 kleure (rooi en blou) kleur, wat is die kleinste n wat waarborg dat daar óf 'n 4-kliek in rooi óf 'n 4-kliek in blou is?",12,15,14,16,22,8,10,20,19,18,9,,math,af
7918,Vind versnelling in m/(min^2) op tyd t = 5 min van 'n helikopter waarvan die hoogte s(t) = 300t - 4t^3 m is.,100,240,180,150,60,-200,-60,-120,-180,-240,7,,math,af
7930,Wat is \lim_{x \to 1} ((x - 1) sin((\pi)/(x - 1))?,π,0,2π,1,ongedefinieerd,e (die basis van die natuurlike logaritme),1/2,-π,1/π,-1,1,,math,af
7935,"Bepaal die werk wat gedoen word deur 'n krag $\mathbf{F}=8 \mathbf{i}-6 \mathbf{j}+9 \mathbf{k}$ wat 'n voorwerp vanaf die punt $(0,10,8)$ na die punt $(6,12,20)$ langs 'n reguit lyn beweeg. Die afstand word in meter gemeet en die krag in newton.",144 $\mathrm{J}$,172 J,180 $\mathrm{J}$,168 J,132 J,160 $\mathrm{J}$,120 $\mathrm{J}$,156 J,200 J,210 J,0,,math,af
7961,Twee heelgetalle het 'n kleinste gemene veelvoud van 60. Elke getal is kleiner of gelyk aan 12. Die grootste gemene faktor van die twee getalle is 2. Wat is die twee getalle?,5 en 12,12 en 15,6 en 12,4 en 8,3 en 9,8 en 10,6 en 10,2 en 10,2 en 6,10 en 12,9,,math,af
7983,"'n Positiewe heelgetal n word 'kragtig' genoem as, vir elke priemfaktor p van n, p^2 ook 'n faktor van n is. 'n Voorbeeld van 'n kragtige getal is",297,392,300,240,336,360,408,,,,1,,math,af
7992,"'n Virus versprei deur die bevolking van 'n dorp, en die aantal mense wat die virus het, verdubbel elke 3 dae. As daar 1,000 mense in die dorp is, en 10 mense het die virus op 1 Januarie, wat is die vroegste datum waarop die hele dorp met die virus besmet sal wees, gegewe dat daar 365 dae in 'n jaar is, en 31 dae in die maand Januarie?",10 Februarie,28 Januarie,10 Januarie,1 Maart,15 Januarie,31 Januarie,10 Maart,21 Januarie,21 Februarie,1 Februarie,7,,math,af
7994,Hoeveel van die 401 heelgetalle vanaf $-200$ tot $200$ is kongruent aan $5 \pmod{13}?$,32,30,46,31,60,62,15,61,29,45,3,,math,af
